{
    "properties": {
        "data": {
            "items": {
                "properties": {
                    "address": {
                        "type": "string"
                    },
                    "branchCode": {
                        "type": "string"
                    },
                    "logo": {
                        "type": "string"
                    },
                    "id": {
                        "type": "integer"
                    },
                    "name": {
                        "type": "string"
                    },
                    "openingHours": {
                        "type": "string"
                    },
                    "timestamp": {
                        "type": "string"
                    }
                },
                "required": [
                    "id",
                    "name",
                    "address",
                    "openingHours",
                    "branchCode",
                    "logo",
                    "timestamp"
                ],
                "type": "object"
            },
            "minItems": 1,
            "type": "array"
        },
        "contenttype": {
            "type": "string"
        },
        "messageid": {
            "type": "string"
        },
        "domain": {
            "type": "string"
        },
        "version": {
            "type": "string"
        },
        "time": {
            "type": "string"
        }
    },
    "required": [
        "messageid",
        "contenttype",
        "version",
        "domain",
        "time"
    ],
    "type": "object",
	"$schema": "http://json-schema.org/draft-04/schema"
}